{
  "xq_version": "0.1",
  "type": "event_collection",
  "generated_at": "2026-08-31T13:30:00Z",
  "producer": "crosscue-semantic-examples",
  "context": {
    "status": "non-normative",
    "purpose": "cross-domain Core semantic examples"
  },
  "events": [
    {
      "xq_version": "0.1",
      "id": "evt:example-mobility-enter-001",
      "event_time": "2026-08-30T08:20:00Z",
      "source": "synthetic-mobility",
      "modality": "xq:mobility",
      "class": "transition",
      "subject": "device:demo-a",
      "feature": "xq:presence",
      "action": "xq:enter",
      "state": "xq:present",
      "polarity": 1,
      "location": {
        "lat": 51.506,
        "lon": -0.12,
        "accuracy_m": 18
      },
      "context": {
        "source_family": "mobility"
      }
    },
    {
      "xq_version": "0.1",
      "id": "evt:example-ais-position-001",
      "event_time": "2026-08-30T11:03:10Z",
      "source": "synthetic-ais-receiver",
      "modality": "xq:ais",
      "class": "observation",
      "subject": "mmsi:235012345",
      "feature": "xq:position",
      "action": "xq:observed",
      "polarity": 0,
      "location": {
        "lat": 50.812,
        "lon": -1.092
      },
      "context": {
        "reported_navigation_status": "at_anchor",
        "sog_kn": 0.2,
        "cog_deg": 247.1
      }
    },
    {
      "xq_version": "0.1",
      "id": "evt:example-adsb-altitude-001",
      "event_time": "2026-08-30T11:08:22Z",
      "source": "synthetic-adsb-receiver",
      "modality": "xq:ads-b",
      "class": "observation",
      "subject": "icao24:406a3d",
      "feature": "xq:altitude",
      "action": "xq:observed",
      "polarity": 0,
      "magnitude": 28750,
      "unit": "ft",
      "location": {
        "lat": 51.234,
        "lon": -1.103
      },
      "context": {
        "altitude_type": "barometric",
        "ground_speed_kn": 412.0
      }
    },
    {
      "xq_version": "0.1",
      "id": "evt:example-rf-signal-001",
      "event_time": "2026-08-30T11:12:03.182Z",
      "observed_time": "2026-08-30T11:12:03.250Z",
      "source": "synthetic-rf-sensor",
      "modality": "xq:rf",
      "class": "observation",
      "feature": "xq:signal",
      "action": "xq:observed",
      "polarity": 0,
      "magnitude": -71.3,
      "unit": "dBm",
      "location": {
        "lat": 51.234,
        "lon": -1.103
      },
      "context": {
        "frequency_hz": 433920000,
        "bandwidth_hz": 25000,
        "bearing_deg": 137.2
      }
    },
    {
      "xq_version": "0.1",
      "id": "evt:example-imagery-presence-001",
      "event_time": "2026-08-30T09:15:00Z",
      "observed_time": "2026-08-30T10:42:00Z",
      "source": "synthetic-imagery-product",
      "modality": "xq:imagery",
      "class": "observation",
      "subject": "object:vehicle-17",
      "feature": "xq:presence",
      "action": "xq:observed",
      "state": "xq:present",
      "polarity": 0,
      "location": {
        "lat": 34.123,
        "lon": 36.456
      },
      "confidence": 0.91,
      "context": {
        "classification": "vehicle",
        "analysis_method": "synthetic_example"
      }
    }
  ]
}
